0,1,2,3,4,5
NECESIDAD,SONDEO,CARACTERISTICA,BENEFICIO A LA  FARMACIA,BENEFICIO AL  CONSUMIDOR,NECESIDAD
"Una  marca  de  antigrípales que  refleje  una  oportunidad de  negocio,  garantizando  una rentabilidad  atractiva.",Dr. Díaz ¿Qué  tan importante  es para usted  con tar con un  producto que le  brinde un  manger  atractivo?,"Nastizol Antigripal  Multisíntomas  le  de 27 soles por  caja, lo que se  refleja en 24% de  utilidad.",Rápida  recuperación  de  la inversión  de  la fármacía,Acceder a un  producto de  calidad como  Nastizol  Antigripal  Multisíntomas a  un precio  accesible,NECESIDAD
"Un  antigripal  seguro,  confiable y de  calidad.",Dr. Díaz ¿Qué  tan importante  es que su  cliente cuente  con un  producto de  calidad?,Nastizol Antigripal  Multisíntomas  la  efectividad  tratamiento  hace  más de 30 años.,"Nastizol  Multisíntomas,  garantiza  el  efectividad  asegún  asegurable  caso de  sus clientes.","Nastizol  Antigripal  Multisíntomas :  tratamiento  efectivado y  confiable,  asegurando la  confianza de  sus clientes.",NECESIDAD
"Un  antigrípal  con respaldo de  inversión  publicitaria  en  TV y en redes  sociales,  garantizando  visibilidad,  confianza  y  preferencia por  los  consumidores",Dr. Díaz ¿qué  tan importante  es para usted  reconmendar la  antigrípal  respaldo por  una fuerte  inversión en  publicidad y  visibilidad para  generar  demanda?,"Nastizol Antigripal  Multisíntomas  cuenta  inversión  publicitaria  en  programas  como  Al fondo hay sitio,  Esto es guerra y  redes sociales.","Mayor, rotación  del  producto  gracias  a  la  demanda  jurada por  publicidad",NECESIDAD,
Una marca que  garantice  una  alta rotación en  el  punto  de  venta  y  una  demanda  constante  parte  de  los  consumidores,Dr. Díaz ¿qué  tan importante  es para usted  con tar con un  producto que le  garantica  la  rotación?,Nastizol Antigripal  Multisíntomas  es  marca  con  fórmula preferida y  además  presentación  sobre x. 2.,Rápido  recuperación de  la rentabilidad  en  el mercad,Seguridad  al  elegir  antigripal  respaldado  por  su trayectoria en  el mercad,NECESIDAD
